{
  "prediction_id": "Prediction_w10233_vb",
  "window_id": "w10233",
  "machine_id": "TMV-720",
  "holder_id": "sth01",
  "target": "tool_wear_vb",
  "value": 0.18,
  "unit": "mm",
  "horizon": {
    "steps_ahead": 1,
    "seconds_ahead": 0.1
  },
  "confidence": 0.91,
  "model_version": "pgnn-toolwear-v1.0",
  "timestamp": "2026-04-13T10:00:00.400Z",
  "ontology_mapping": {
    "class_uri": "mis:Prediction",
    "individual_uri": "mis:Prediction_w10233_vb",
    "json_field_uri": "sth:Field_toolwear",
    "mqtt_topic_uri": "sth:Topic_ToolWear",
    "opcua_node_uri": "sth:OPCUA_ToolWearVB"
  }
}
